{
  "$schema": "../schemas/dotnet-skills-provenance.schema.json",
  "manifestVersion": 2,
  "snapshot": {
    "repository": "dotnet/skills",
    "url": "https://github.com/dotnet/skills",
    "branch": "main",
    "commit": "4ed5f7c121da8dd31af31a35cef05070948c6556",
    "commitDate": "2026-09-22T13:36:54-07:00",
    "inspectedAt": "2026-09-22",
    "license": { "spdx": "MIT", "path": "LICENSE", "copyright": ".NET Foundation and Contributors" }
  },
  "policy": {
    "integration": "One codex-toolkit plugin only. Upstream plugins remain separately installable references and are never bundled as additional toolkit plugins.",
    "context": "Use decision records as routing metadata; load an upstream skill or compact local reference only after a narrow trigger.",
    "vendor": "Repository guidance forbids vendoring upstream .NET skill content, so VENDOR_UNCHANGED and VENDOR_OPTIMIZE are intentionally unused.",
    "install": "Do not install the entire upstream marketplace. Select a pinned upstream plugin only for an explicit task that benefits from it."
  },
  "summary": { "plugins": 16, "skills": 100, "skillBytes": 1307906, "skillWords": 171532, "supportingFiles": 157, "supportingBytes": 1020359 },
  "plugins": [
    {
      "id": "dotnet", "version": "0.2.4", "path": "plugins/dotnet", "codexPluginPath": "plugins/dotnet/.codex-plugin/plugin.json", "license": "MIT",
      "skillCount": 2, "skillBytes": 25944, "skillWords": 3461, "supportingFileCount": 1, "supportingBytes": 2875,
      "skills": ["csharp-refactoring", "setup-local-sdk"], "mcpServers": [], "defaultDisposition": "KEEP_UPSTREAM"
    },
    {
      "id": "dotnet-advanced", "version": "0.2.2", "path": "plugins/dotnet-advanced", "codexPluginPath": "plugins/dotnet-advanced/.codex-plugin/plugin.json", "license": "MIT",
      "skillCount": 4, "skillBytes": 52392, "skillWords": 6937, "supportingFileCount": 4, "supportingBytes": 19146,
      "skills": ["csharp-scripts", "dotnet-pinvoke", "nuget-trusted-publishing", "vectorization"], "mcpServers": [], "defaultDisposition": "KEEP_UPSTREAM"
    },
    {
      "id": "dotnet-ai", "version": "0.1.6", "path": "plugins/dotnet-ai", "codexPluginPath": "plugins/dotnet-ai/.codex-plugin/plugin.json", "license": "MIT",
      "skillCount": 1, "skillBytes": 8513, "skillWords": 1132, "supportingFileCount": 7, "supportingBytes": 11578,
      "skills": ["technology-selection"], "mcpServers": [], "defaultDisposition": "DO_NOT_INSTALL"
    },
    {
      "id": "dotnet-aspnetcore", "version": "0.1.1", "path": "plugins/dotnet-aspnetcore", "codexPluginPath": "plugins/dotnet-aspnetcore/.codex-plugin/plugin.json", "license": "MIT",
      "skillCount": 4, "skillBytes": 59726, "skillWords": 7110, "supportingFileCount": 0, "supportingBytes": 0,
      "skills": ["configuring-opentelemetry-dotnet", "convert-blazor-server-to-webapp", "dotnet-webapi", "minimal-api-file-upload"], "mcpServers": [], "defaultDisposition": "KEEP_UPSTREAM"
    },
    {
      "id": "dotnet-blazor", "version": "0.1.1", "path": "plugins/dotnet-blazor", "codexPluginPath": "plugins/dotnet-blazor/.codex-plugin/plugin.json", "license": "MIT",
      "skillCount": 10, "skillBytes": 87422, "skillWords": 10809, "supportingFileCount": 10, "supportingBytes": 29145,
      "skills": ["author-component", "collect-user-input", "configure-auth", "coordinate-components", "create-blazor-project", "fetch-and-send-data", "plan-ui-change", "support-prerendering", "use-igniteui-blazor", "use-js-interop"], "mcpServers": [], "defaultDisposition": "DO_NOT_INSTALL"
    },
    {
      "id": "dotnet-data", "version": "0.1.5", "path": "plugins/dotnet-data", "codexPluginPath": "plugins/dotnet-data/.codex-plugin/plugin.json", "license": "MIT",
      "skillCount": 2, "skillBytes": 23695, "skillWords": 3388, "supportingFileCount": 0, "supportingBytes": 0,
      "skills": ["create-datadriven-aspnetcore", "optimizing-ef-core-queries"], "mcpServers": [], "defaultDisposition": "KEEP_UPSTREAM"
    },
    {
      "id": "dotnet-diag", "version": "0.1.2", "path": "plugins/dotnet-diag", "codexPluginPath": "plugins/dotnet-diag/.codex-plugin/plugin.json", "license": "MIT",
      "skillCount": 7, "skillBytes": 93681, "skillWords": 13022, "supportingFileCount": 26, "supportingBytes": 229391,
      "skills": ["analyzing-dotnet-performance", "android-tombstone-symbolication", "apple-crash-symbolication", "clr-activation-debugging", "dotnet-trace-collect", "dump-collect", "microbenchmarking"], "mcpServers": [], "defaultDisposition": "KEEP_UPSTREAM"
    },
    {
      "id": "dotnet-experimental", "version": "0.1.2", "path": "plugins/dotnet-experimental", "codexPluginPath": "plugins/dotnet-experimental/.codex-plugin/plugin.json", "license": "MIT",
      "skillCount": 2, "skillBytes": 15735, "skillWords": 2270, "supportingFileCount": 0, "supportingBytes": 0,
      "skills": ["exp-mock-usage-analysis", "exp-test-maintainability"], "mcpServers": [], "defaultDisposition": "DO_NOT_INSTALL"
    },
    {
      "id": "dotnet-maui", "version": "0.1.16", "path": "plugins/dotnet-maui", "codexPluginPath": "plugins/dotnet-maui/.codex-plugin/plugin.json", "license": "MIT",
      "skillCount": 8, "skillBytes": 113113, "skillWords": 13159, "supportingFileCount": 18, "supportingBytes": 78305,
      "skills": ["dotnet-maui-doctor", "maui-app-lifecycle", "maui-collectionview", "maui-data-binding", "maui-dependency-injection", "maui-safe-area", "maui-shell-navigation", "maui-theming"], "mcpServers": [], "defaultDisposition": "DO_NOT_INSTALL"
    },
    {
      "id": "dotnet-msbuild", "version": "0.1.10", "path": "plugins/dotnet-msbuild", "codexPluginPath": "plugins/dotnet-msbuild/.codex-plugin/plugin.json", "license": "MIT",
      "skillCount": 18, "skillBytes": 172580, "skillWords": 20341, "supportingFileCount": 6, "supportingBytes": 30712,
      "skills": ["binlog-failure-analysis", "binlog-generation", "build-parallelism", "build-perf-baseline", "build-perf-diagnostics", "check-bin-obj-clash", "copy-to-output-directory", "directory-build-organization", "eval-performance", "extension-points", "including-generated-files", "incremental-build", "item-management", "msbuild-antipatterns", "msbuild-modernization", "property-patterns", "resolve-project-references", "target-authoring"],
      "mcpServers": ["binlog: dotnet dnx Microsoft.AITools.BinlogMcp --yes --prerelease"], "defaultDisposition": "KEEP_UPSTREAM"
    },
    {
      "id": "dotnet-nuget", "version": "0.1.1", "path": "plugins/dotnet-nuget", "codexPluginPath": "plugins/dotnet-nuget/.codex-plugin/plugin.json", "license": "MIT",
      "skillCount": 1, "skillBytes": 14283, "skillWords": 1944, "supportingFileCount": 6, "supportingBytes": 27026,
      "skills": ["convert-to-cpm"], "mcpServers": [], "defaultDisposition": "KEEP_UPSTREAM"
    },
    {
      "id": "dotnet-template-engine", "version": "0.1.4", "path": "plugins/dotnet-template-engine", "codexPluginPath": "plugins/dotnet-template-engine/.codex-plugin/plugin.json", "license": "MIT",
      "skillCount": 6, "skillBytes": 64609, "skillWords": 9352, "supportingFileCount": 0, "supportingBytes": 0,
      "skills": ["template-authoring", "template-comparison", "template-discovery", "template-instantiation", "template-smart-defaults", "template-validation"], "mcpServers": [], "defaultDisposition": "KEEP_UPSTREAM"
    },
    {
      "id": "dotnet-test", "version": "0.2.22", "path": "plugins/dotnet-test", "codexPluginPath": "plugins/dotnet-test/.codex-plugin/plugin.json", "license": "MIT",
      "skillCount": 22, "skillBytes": 325637, "skillWords": 45183, "supportingFileCount": 44, "supportingBytes": 408775,
      "skills": ["assertion-quality", "code-testing-agent", "code-testing-extensions", "coverage-analysis", "crap-score", "detect-static-dependencies", "filter-syntax", "find-untested-sources", "generate-testability-wrappers", "grade-tests", "migrate-static-to-wrapper", "mtp-hot-reload", "platform-detection", "run-tests", "scaffold-dotnet-test-project", "test-analysis-extensions", "test-anti-patterns", "test-gap-analysis", "test-smell-detection", "test-tagging", "testability-obstacle", "writing-mstest-tests"], "mcpServers": [], "defaultDisposition": "KEEP_UPSTREAM"
    },
    {
      "id": "dotnet-test-migration", "version": "0.1.9", "path": "plugins/dotnet-test-migration", "codexPluginPath": "plugins/dotnet-test-migration/.codex-plugin/plugin.json", "license": "MIT",
      "skillCount": 6, "skillBytes": 119411, "skillWords": 16029, "supportingFileCount": 2, "supportingBytes": 44132,
      "skills": ["migrate-mstest-v1v2-to-v3", "migrate-mstest-v3-to-v4", "migrate-nunit-to-mstest", "migrate-vstest-to-mtp", "migrate-xunit-to-mstest", "migrate-xunit-to-xunit-v3"], "mcpServers": [], "defaultDisposition": "KEEP_UPSTREAM"
    },
    {
      "id": "dotnet-upgrade", "version": "0.1.1", "path": "plugins/dotnet-upgrade", "codexPluginPath": "plugins/dotnet-upgrade/.codex-plugin/plugin.json", "license": "MIT",
      "skillCount": 6, "skillBytes": 115434, "skillWords": 15444, "supportingFileCount": 33, "supportingBytes": 139274,
      "skills": ["dotnet-aot-compat", "migrate-dotnet10-to-dotnet11", "migrate-dotnet8-to-dotnet9", "migrate-dotnet9-to-dotnet10", "migrate-nullable-references", "thread-abort-migration"], "mcpServers": [], "defaultDisposition": "KEEP_UPSTREAM"
    },
    {
      "id": "dotnet11", "version": "0.1.2", "path": "plugins/dotnet11", "codexPluginPath": "plugins/dotnet11/.codex-plugin/plugin.json", "license": "MIT",
      "skillCount": 1, "skillBytes": 15731, "skillWords": 1951, "supportingFileCount": 0, "supportingBytes": 0,
      "skills": ["system-text-json-net11"], "mcpServers": [], "defaultDisposition": "DO_NOT_INSTALL"
    }
  ],
  "decisions": [
    {
      "id": "test-platform-and-execution", "capabilities": ["tests"], "plugin": "dotnet-test",